{
  "meta": {
    "schema_version": "1.0",
    "run_id": "synthetic-run",
    "generated_at": "2026-10-19T18:00:00+08:00",
    "as_of": "2026-10-19T17:00:00+08:00",
    "timezone": "Asia/Taipei",
    "confidence": "low",
    "status": "partial",
    "approval_status": "draft",
    "limitations": [
      "合成資料，無真實市場驗證"
    ],
    "sources": [],
    "data_gaps": [
      "未接真實資料來源"
    ]
  },
  "request_id": "synthetic-request",
  "instrument": {
    "ticker": "0000",
    "name": "合成測試公司",
    "market": "TWSE",
    "asset_type": "stock",
    "currency": "TWD"
  },
  "path": "company",
  "verdict": "insufficient_data",
  "summary": "合成樣本，未完成研究。",
  "information_richness": "C",
  "thesis_pillars": [],
  "risks": [],
  "kill_criteria": [],
  "next_checks": [],
  "company_analysis": {
    "business_model": "合成格式測試，未取得真實資料",
    "financial_snapshot": [],
    "financial_quality": [
      "資料不足"
    ],
    "moat_and_governance": [],
    "five_vector_checks": {
      "accounting": "未驗證",
      "expectations": "未驗證",
      "operations": "未驗證",
      "competition": "未驗證",
      "macro": "未驗證"
    },
    "valuation": {
      "method": "not_assessed",
      "scenarios": [],
      "sensitivity_notes": [],
      "calculation_records": [],
      "limitations": [
        "合成資料，不估值"
      ]
    }
  }
}
